sudo mysql -u root -p
[sudo] password for student: 
Enter password: 
Welcome to the MariaDB monitor.  Commands end with ; or \g.
Your MariaDB connection id is 33
Server version: 10.0.38-MariaDB-0ubuntu0.16.04.1 Ubuntu 16.04

Copyright (c) 2000, 2018, Oracle, MariaDB Corporation Ab and others.

Type 'help;' or '\h' for help. Type '\c' to clear the current input statement.

MariaDB [(none)]> use db1;
Reading table information for completion of table and column names
You can turn off this feature to get a quicker startup with -A
MariaDB [db1]> create table jobs(jobid int primary key,jobtitle varchar(50),minsal int,maxsal int);
Query OK, 0 rows affected (0.23 sec)

MariaDB [db1]> insert into jobs values(100,'manager',20000,50000);
Query OK, 1 row affected (0.04 sec)

MariaDB [db1]> insert into jobs values(110,'developer',18000,50000);
Query OK, 1 row affected (0.04 sec)

MariaDB [db1]> insert into jobs values(145,'GM',50000,100000);
Query OK, 1 row affected (0.04 sec)

MariaDB [db1]> insert into jobs values(150,'sales executive',20000,30000);
Query OK, 1 row affected (0.03 sec)

MariaDB [db1]> insert into jobs values(155,'pgm developer',40000,60000);
Query OK, 1 row affected (0.03 sec)

MariaDB [db1]> select * from jobs;
+-------+-----------------+--------+--------+
| jobid | jobtitle        | minsal | maxsal |
+-------+-----------------+--------+--------+
|   100 | manager         |  20000 |  50000 |
|   110 | developer       |  18000 |  50000 |
|   145 | GM              |  50000 | 100000 |
|   150 | sales executive |  20000 |  30000 |
|   155 | pgm developer   |  40000 |  60000 |
+-------+-----------------+--------+--------+
5 rows in set (0.00 sec)

MariaDB [db1]> create table departments(dept_id int primary key,dept_name varchar(40));
Query OK, 0 rows affected (0.24 sec)

MariaDB [db1]> insert into departments values(20,'Technical');
Query OK, 1 row affected (0.04 sec)

MariaDB [db1]> insert into departments values(22,'leadership');
Query OK, 1 row affected (0.03 sec)

MariaDB [db1]> insert into departments values(24,'client');
Query OK, 1 row affected (0.04 sec)
MariaDB [db1]> insert into departments values(25,'project_head');
Query OK, 1 row affected (0.03 sec)

MariaDB [db1]> insert into departments values(26,'hr_manager');
Query OK, 1 row affected (0.04 sec)

MariaDB [db1]> select * from departments;
+---------+--------------+
| dept_id | dept_name    |
+---------+--------------+
|      20 | Technical    |
|      22 | leadership   |
|      24 | client       |
|      25 | project_head |
|      26 | hr_manager   |
+---------+--------------+
5 rows in set (0.00 sec)

MariaDB [db1]> create table employees(empid int primary key,first_name varchar(40),last_name varchar(40),email varchar(60),phn_num long,hire_date date,jobid int references jobs,salary int,manager_id int,dept_id int references departments);
Query OK, 0 rows affected (0.21 sec)

MariaDB [db1]> insert into employees values(1,'Thasni','Rashid','thasnisaleem@gmail.com',9115711503,'2015-02-13',110,10000,500,22);
Query OK, 1 row affected (0.04 sec)

MariaDB [db1]> insert into employees values(2,'jabir','MJ','jabirmj4@gmail.com',9845120360,'2016-03-04',100,40000,510,20);
Query OK, 1 row affected (0.69 sec)

MariaDB [db1]> insert into employees values(3,'Reshma','Ramesh','reshmaramesh@gmail.com',7812036510,'2014-06-09',145,80000,511,24);
Query OK, 1 row affected (0.03 sec)

MariaDB [db1]> insert iinsert into employees values(5,'sarang','Raju','sarangnjattuvetty@gmail.com',8712003695,'2019-07-09',155,50000,567,26);nto employees values(4,'Amalendu','KM','amalendu1999@gmail.com',9825630147,'2018-11-23',150,40000,459,25);
Query OK, 1 row affected (0.04 sec)

MariaDB [db1]> insert into employees values(5,'sarang','Raju','sarangnjattuvetty@gmail.com',8712003695,'2019-07-09',155,50000,567,26);
Query OK, 1 row affected (0.03 sec)

MariaDB [db1]> select * from employees;
+-------+------------+-----------+-----------------------------+------------+------------+-------+--------+------------+---------+
| empid | first_name | last_name | email                       | phn_num    | hire_date  | jobid | salary | manager_id | dept_id |
+-------+------------+-----------+-----------------------------+------------+------------+-------+--------+------------+---------+
|     1 | Thasni     | Rashid    | thasnisaleem@gmail.com      | 9115711503 | 2015-02-13 |   110 |  10000 |        500 |      22 |
|     2 | jabir      | MJ        | jabirmj4@gmail.com          | 9845120360 | 2016-03-04 |   100 |  40000 |        510 |      20 |
|     3 | Reshma     | Ramesh    | reshmaramesh@gmail.com      | 7812036510 | 2014-06-09 |   145 |  80000 |        511 |      24 |
|     4 | Amalendu   | KM        | amalendu1999@gmail.com      | 9825630147 | 2018-11-23 |   150 |  40000 |        459 |      25 |
|     5 | sarang     | Raju      | sarangnjattuvetty@gmail.com | 8712003695 | 2019-07-09 |   155 |  50000 |        567 |      26 |
+-------+------------+-----------+-----------------------------+------------+------------+-------+--------+------------+---------+
5 rows in set (0.00 sec)

MariaDB [db1]> alter table departments rename to dept;
Query OK, 0 rows affected (0.09 sec)

MariaDB [db1]> alter table employees  modify salary smallint;
Query OK, 5 rows affected, 4 warnings (0.58 sec)   
Records: 5  Duplicates: 0  Warnings: 4

MariaDB [db1]> alter table employees add commission int;
Query OK, 0 rows affected (0.33 sec)
Records: 0  Duplicates: 0  Warnings: 0

MariaDB [db1]> alter table employees drop hire_date;
Query OK, 0 rows affected (0.36 sec)
Records: 0  Duplicates: 0  Warnings: 0

MariaDB [db1]> select * from employees left join jobs on jobs.jobid=employees.jobid left join dept on dept.dept_id=employees.dept_id; 
+-------+------------+-----------+-----------------------------+------------+-------+--------+------------+---------+------------+-------+-----------------+--------+--------+---------+--------------+
| empid | first_name | last_name | email                       | phn_num    | jobid | salary | manager_id | dept_id | commission | jobid | jobtitle        | minsal | maxsal | dept_id | dept_name    |
+-------+------------+-----------+-----------------------------+------------+-------+--------+------------+---------+------------+-------+-----------------+--------+--------+---------+--------------+
|     1 | Thasni     | Rashid    | thasnisaleem@gmail.com      | 9115711503 |   110 |  10000 |        500 |      22 |       NULL |   110 | developer       |  18000 |  50000 |      22 | leadership   |
|     2 | jabir      | MJ        | jabirmj4@gmail.com          | 9845120360 |   100 |  32767 |        510 |      20 |       NULL |   100 | manager         |  20000 |  50000 |      20 | Technical    |
|     3 | Reshma     | Ramesh    | reshmaramesh@gmail.com      | 7812036510 |   145 |  32767 |        511 |      24 |       NULL |   145 | GM              |  50000 | 100000 |      24 | client       |
|     4 | Amalendu   | KM        | amalendu1999@gmail.com      | 9825630147 |   150 |  32767 |        459 |      25 |       NULL |   150 | sales executive |  20000 |  30000 |      25 | project_head |
|     5 | sarang     | Raju      | sarangnjattuvetty@gmail.com | 8712003695 |   155 |  32767 |        567 |      26 |       NULL |   155 | pgm developer   |  40000 |  60000 |      26 | hr_manager   |
+-------+------------+-----------+-----------------------------+------------+-------+--------+------------+---------+------------+-------+-----------------+--------+--------+---------+--------------+
5 rows in set (0.00 sec)

MariaDB [db1]> select * from employees where salary>30000;
+-------+------------+-----------+-----------------------------+------------+-------+--------+------------+---------+------------+
| empid | first_name | last_name | email                       | phn_num    | jobid | salary | manager_id | dept_id | commission |
+-------+------------+-----------+-----------------------------+------------+-------+--------+------------+---------+------------+
|     2 | jabir      | MJ        | jabirmj4@gmail.com          | 9845120360 |   100 |  32767 |        510 |      20 |       NULL |
|     3 | Reshma     | Ramesh    | reshmaramesh@gmail.com      | 7812036510 |   145 |  32767 |        511 |      24 |       NULL |
|     4 | Amalendu   | KM        | amalendu1999@gmail.com      | 9825630147 |   150 |  32767 |        459 |      25 |       NULL |
|     5 | sarang     | Raju      | sarangnjattuvetty@gmail.com | 8712003695 |   155 |  32767 |        567 |      26 |       NULL |
+-------+------------+-----------+-----------------------------+------------+-------+--------+------------+---------+------------+
4 rows in set (0.00 sec)

MariaDB [db1]> update  employees set commission=1000 where dept_id=20;
Query OK, 1 row affected (0.05 sec)
Rows matched: 1  Changed: 1  Warnings: 0

MariaDB [db1]> update  employees set commission=1500 where dept_id=24;
Query OK, 1 row affected (0.04 sec)
Rows matched: 1  Changed: 1  Warnings: 0

MariaDB [db1]> update  employees set commission=2000 where dept_id=25;
Query OK, 1 row affected (0.04 sec)
Rows matched: 1  Changed: 1  Warnings: 0

MariaDB [db1]> update  employees set commission=2500 where dept_id=26;
Query OK, 1 row affected (0.02 sec)
Rows matched: 1  Changed: 1  Warnings: 0

MariaDB [db1]> update employees set commission=2500 where dept_id=22;
Query OK, 1 row affected (0.02 sec)
Rows matched: 1  Changed: 1  Warnings: 0

MariaDB [db1]> select  first_name,commission from employees;
+------------+------------+
| first_name | commission |
+------------+------------+
| Thasni     |       2500 |
| jabir      |       1000 |
| Reshma     |       1500 |
| Amalendu   |       2000 |
| sarang     |       2500 |
+------------+------------+
5 rows in set (0.00 sec)

MariaDB [db1]> delete from employees where empid=4;
Query OK, 1 row affected (0.03 sec)

MariaDB [db1]> select empid,first_name from employees;
+-------+------------+
| empid | first_name |
+-------+------------+
|     1 | Thasni     |
|     2 | jabir      |
|     3 | Reshma     |
|     5 | sarang     |
+-------+------------+
4 rows in set (0.00 sec)








