Copyright (c) 2000, 2018, Oracle, MariaDB Corporation Ab and others.

Type 'help;' or '\h' for help. Type '\c' to clear the current input statement.

MariaDB [(none)]> create table clientmaster(clientno varchar(30),name varchar(20),address varchar(30),city varchar(30),pincode int,state varchar(20));
Database changed
MariaDB [db1]> insert into clientmaster values('c0100','sarang','njattuvetty','thrissur',680642,'kerala');
Query OK, 1 row affected (0.04 sec)

MariaDB [db1]> insert into clientmaster values('c0200','sarang','njattuvetty','palakad',680632,'kerala');
Query OK, 1 row affected (0.03 sec)

MariaDB [db1]> insert into clientmaster values('c0300','ohm','vrindhavan','malapuram',680732,'kerala');
Query OK, 1 row affected (0.04 sec)

MariaDB [db1]> insert into clientmaster values('c0400','krishna','vrindhavan','thrissur',680642,'kerala');
Query OK, 1 row affected (0.03 sec)

MariaDB [db1]> insert into clientmaster values('c0500','krishna','bakthagriham','coimbathore',763523,'tamil nadu');
Query OK, 1 row affected (0.04 sec)

MariaDB [db1]> select * from clientmaster;
+----------+---------+--------------+-------------+---------+------------+
| clientno | name    | address      | city        | pincode | state      |
+----------+---------+--------------+-------------+---------+------------+
| c0100    | sarang  | njattuvetty  | thrissur    |  680642 | kerala     |
| c0200    | sarang  | njattuvetty  | palakad     |  680632 | kerala     |
| c0300    | ohm     | vrindhavan   | malapuram   |  680732 | kerala     |
| c0400    | krishna | vrindhavan   | thrissur    |  680642 | kerala     |
| c0500    | krishna   | bakthagriham | coimbathore |  763523 | tamil nadu |
+----------+---------+--------------+-------------+---------+------------+
5 rows in set (0.01 sec)
MariaDB [db1]> update clientmaster set name='jaya' where clientno='c0200';
Query OK, 1 row affected (0.04 sec)
Rows matched: 1  Changed: 1  Warnings: 0
MariaDB [db1]> select * from clientmaster;
+----------+---------+--------------+-------------+---------+------------+
| clientno | name    | address      | city        | pincode | state      |
+----------+---------+--------------+-------------+---------+------------+
| c0100    | sarang  | njattuvetty  | thrissur    |  680642 | kerala     |
| c0200    | jaya    | njattuvetty  | palakad     |  680632 | kerala     |
| c0300    | ohm     | vrindhavan   | malapuram   |  680732 | kerala     |
| c0400    | krishna | vrindhavan   | thrissur    |  680642 | kerala     |
| c0500    | krishna | bakthagriham | coimbathore |  763523 | tamil nadu |
+----------+---------+--------------+-------------+---------+------------+
5 rows in set (0.00 sec)

MariaDB [db1]> select clientno,name from clientmaster;
+----------+---------+
| clientno | name    |
+----------+---------+
| c0100    | sarang  |
| c0200    | jaya    |
| c0300    | ohm     |
| c0400    | krishna |
| c0500    | krishna |
+----------+---------+
5 rows in set (0.00 sec)

MariaDB [db1]> select distinct(name) from clientmaster;
+---------+
| name    |
+---------+
| sarang  |
| jaya    |
| ohm     |
| krishna |
+---------+
4 rows in set (0.00 sec)

MariaDB [db1]> select clientno from clientmaster order by clientno; 
+----------+
| clientno |
+----------+
| c0100    |
| c0200    |
| c0300    |
| c0400    |
| c0500    |
+----------+
5 rows in set (0.00 sec)

MariaDB [db1]> select name  from clientmaster order by name; 
+---------+
| name    |
+---------+
| jaya    |
| krishna |
| krishna |
| ohm     |
| sarang  |
+---------+
5 rows in set (0.00 sec)

MariaDB [db1]> select address  from clientmaster order by address; 
+--------------+
| address      |
+--------------+
| bakthagriham |
| njattuvetty  |
| njattuvetty  |
| vrindhavan   |
| vrindhavan   |
+--------------+
5 rows in set (0.00 sec)

MariaDB [db1]> select city  from clientmaster order by city; 
+-------------+
| city        |
+-------------+
| coimbathore |
| malapuram   |
| palakad     |
| thrissur    |
| thrissur    |
+-------------+
5 rows in set (0.00 sec)

MariaDB [db1]> select clientno from clientmaster order by clientno desc; 
+----------+
| clientno |
+----------+
| c0500    |
| c0400    |
| c0300    |
| c0200    |
| c0100    |
+----------+
5 rows in set (0.00 sec)

MariaDB [db1]> select name  from clientmaster order by name desc; 
+---------+
| name    |
+---------+
| sarang  |
| ohm     |
| krishna |
| krishna |
| jaya    |
+---------+
5 rows in set (0.00 sec)

MariaDB [db1]> select address  from clientmaster order by address desc; 
+--------------+
| address      |
+--------------+
| vrindhavan   |
| vrindhavan   |
| njattuvetty  |
| njattuvetty  |
| bakthagriham |
+--------------+
5 rows in set (0.00 sec)

MariaDB [db1]> select city  from clientmaster order by city desc; 
+-------------+
| city        |
+-------------+
| thrissur    |
| thrissur    |
| palakad     |
| malapuram   |
| coimbathore |
+-------------+
5 rows in set (0.00 sec)

MariaDB [db1]> select clientno,name from clientmaster where clientno=c0200;
ERROR 1054 (42S22): Unknown column 'c0200' in 'where clause'
MariaDB [db1]> select clientno,name from clientmaster where clientno='c0200';
+----------+------+
| clientno | name |
+----------+------+
| c0200    | jaya |
+----------+------+
1 row in set (0.00 sec)

MariaDB [db1]> alter table clientmaster add telephoneno varchar(20);
Query OK, 0 rows affected (0.39 sec)
Records: 0  Duplicates: 0  Warnings: 0

MariaDB [db1]> alter table clientmaster add faxno varchar(20);
Query OK, 0 rows affected (0.35 sec)
Records: 0  Duplicates: 0  Warnings: 0

MariaDB [db1]> select * from clientmaster;
+----------+---------+--------------+-------------+---------+------------+-------------+-------+
| clientno | name    | address      | city        | pincode | state      | telephoneno | faxno |
+----------+---------+--------------+-------------+---------+------------+-------------+-------+
| c0100    | sarang  | njattuvetty  | thrissur    |  680642 | kerala     | NULL        | NULL  |
| c0200    | jaya    | njattuvetty  | palakad     |  680632 | kerala     | NULL        | NULL  |
| c0300    | ohm     | vrindhavan   | malapuram   |  680732 | kerala     | NULL        | NULL  |
| c0400    | krishna | vrindhavan   | thrissur    |  680642 | kerala     | NULL        | NULL  |
| c0500    | krishna | bakthagriham | coimbathore |  763523 | tamil nadu | NULL        | NULL  |
+----------+---------+--------------+-------------+---------+------------+-------------+-------+
5 rows in set (0.00 sec)

MariaDB [db1]> update clientmaster set telephoneno='7012296803' where clientno='c0100';
Query OK, 1 row affected (0.04 sec)
Rows matched: 1  Changed: 1  Warnings: 0

MariaDB [db1]> update clientmaster set telephoneno='7012296673' where clientno='c0200';
Query OK, 1 row affected (0.03 sec)
Rows matched: 1  Changed: 1  Warnings: 0

MariaDB [db1]> update clientmaster set telephoneno='7012296345' where clientno='c0300';
Query OK, 1 row affected (0.03 sec)
Rows matched: 1  Changed: 1  Warnings: 0

MariaDB [db1]> update clientmaster set telephoneno='7012696345' where clientno='c0400';
Query OK, 1 row affected (0.04 sec)
Rows matched: 1  Changed: 1  Warnings: 0

MariaDB [db1]> update clientmaster set telephoneno='7012635345' where clientno='c0500';
Query OK, 1 row affected (0.03 sec)
Rows matched: 1  Changed: 1  Warnings: 0

MariaDB [db1]> update clientmaster set faxno='7012' where clientno='c0100';
Query OK, 1 row affected (0.04 sec)
Rows matched: 1  Changed: 1  Warnings: 0

MariaDB [db1]> update clientmaster set faxno='70122' where clientno='c0200';
Query OK, 1 row affected (0.04 sec)
Rows matched: 1  Changed: 1  Warnings: 0

MariaDB [db1]> update clientmaster set faxno='7022' where clientno='c0300';
Query OK, 1 row affected (0.03 sec)
Rows matched: 1  Changed: 1  Warnings: 0

MariaDB [db1]> update clientmaster set faxno='7032' where clientno='c0400';
Query OK, 1 row affected (0.03 sec)
Rows matched: 1  Changed: 1  Warnings: 0

MariaDB [db1]> update clientmaster set faxno='74532' where clientno='c0500';
Query OK, 1 row affected (0.04 sec)
Rows matched: 1  Changed: 1  Warnings: 0

MariaDB [db1]> select * from clientmaster;
+----------+---------+--------------+-------------+---------+------------+-------------+-------+
| clientno | name    | address      | city        | pincode | state      | telephoneno | faxno |
+----------+---------+--------------+-------------+---------+------------+-------------+-------+
| c0100    | sarang  | njattuvetty  | thrissur    |  680642 | kerala     | 7012296803  | 7012  |
| c0200    | jaya    | njattuvetty  | palakad     |  680632 | kerala     | 7012296673  | 70122 |
| c0300    | ohm     | vrindhavan   | malapuram   |  680732 | kerala     | 7012296345  | 7022  |
| c0400    | krishna | vrindhavan   | thrissur    |  680642 | kerala     | 7012696345  | 7032  |
| c0500    | krishna | bakthagriham | coimbathore |  763523 | tamil nadu | 7012635345  | 74532 |
+----------+---------+--------------+-------------+---------+------------+-------------+-------+
5 rows in set (0.00 sec)

MariaDB [db1]> alter table clientmaster modify column faxno varchAR(30);
Query OK, 5 rows affected (0.62 sec)               
Records: 5  Duplicates: 0  Warnings: 0

MariaDB [db1]> desc clientmaster;
+-------------+-------------+------+-----+---------+-------+
| Field       | Type        | Null | Key | Default | Extra |
+-------------+-------------+------+-----+---------+-------+
| clientno    | varchar(30) | YES  |     | NULL    |       |
| name        | varchar(20) | YES  |     | NULL    |       |
| address     | varchar(30) | YES  |     | NULL    |       |
| city        | varchar(30) | YES  |     | NULL    |       |
| pincode     | int(11)     | YES  |     | NULL    |       |
| state       | varchar(20) | YES  |     | NULL    |       |
| telephoneno | varchar(20) | YES  |     | NULL    |       |
| faxno       | varchar(30) | YES  |     | NULL    |       |
+-------------+-------------+------+-----+---------+-------+
8 rows in set (0.01 sec)

MariaDB [db1]> 

